
dlga_lord_denounce_3:close_window|Как у вас язык повернулся? Подобное оскорбление после стольких дней нашей дружбы подобно удару ножом в спину -- оно разит больнее, чем меч врага. Не знаю, что за игру вы затеяли, но принимать в ней участие я не желаю. Прочь. Я не хочу вас видеть.
dlga_lord_denounce_3:close_window.1|Вот как? Вы сами это придумали или мои враги научили вас, что говорить? А впрочем, неважно. Я не стану участвовать в вашей игре. Убирайтесь и прихватите с собой клубок интриг.
dlga_lord_denounce_3:lord_denounce_4|{reg59?Миледи:Сир}, я не позволю пятнать свое имя. Возьмите свои слова назад или в следующий раз мы встретимся на поединке.
dlga_lord_denounce_3:lord_denounce_4.1|Действительно? Так вот что я вам скажу: вы змея, мошенник и если не осмелитесь выступить против меня в поединке, то еще и трус. Что вы на это скажете? Вы забираете свои слова обратно или желаете скрестить мечи?
dlga_lord_denounce_4:lord_respond_to_insult_challenge_duel_confirm|Я с удовольствием скрещу с вами мечи.
dlga_lord_denounce_4:lord_denounce_retract|Мне... Мне не стоило столько пить. Приношу свои извинения.
dlga_lord_denounce_retract:lord_pretalk|Я так и думал. А теперь убирайтесь отсюда.
dlga_lord_talk:lord_respond_to_insult|{s9}
dlga_lord_talk:lord_quarrel_intervention_1|Мне бы хотелось поговорить о вашей ссоре с {s11}.
dlga_lord_talk:lord_recruit_1_relation|Подождите! Мне надо вам кое-что сказать. 
dlga_lord_talk:lord_gift_improverelation|(Передать дар воину, колец и украшений на 5000 шиллингов)
dlga_lord_gift_improverelation:lord_pretalk|Спасибо, я горжусь тем, что меня так вознаградили.
dlga_lord_talk:lord_bandit_information|Я разыскиваю шайку разбойников с такими приметами... Вы их видели?
dlga_lord_bandit_information:lord_pretalk|{s15}
dlga_lord_talk:lord_internal_politics_cur_stance|Кого, по вашему мнению, следует назначить Главнокомандующим нашего королевства?
dlga_lord_talk:lord_internal_politics_cur_stance.1|Кто, по вашему мнению, должен получить в надел {s4}?
dlga_lord_talk:lord_husband_auto_recruit|Нужно, чтобы вы отказались от клятвы {s4} и присоединились к {s5}, муж мой.
dlga_lord_husband_auto_recruit:lord_pretalk|Поговорим позже, будучи наедине.
dlga_lord_husband_auto_recruit:close_window|Как пожелаешь, моя любимая.
dlga_lord_talk:reclutar_permiso1|Я хочу просить разрешения набирать воинов в ваших землях.
dlga_lord_talk:lord_recruit_1_relation.1|Мне бы хотелось с вами кое-что обсудить. Наедине.
dlga_lord_talk:lord_reveal|Ходят слухи, что вы хотели меня убить.
dlga_lord_talk:lord_recruit_1_relation.2|Мне бы хотелось поговорить с вами наедине.
dlga_lord_talk:lord_talk|ЧИТ -- Убрать нетерпимость знати к интригам.
dlga_lord_talk:lord_respond_to_insult_challenge_duel|ЧИТ -- Вызвать на поединок!
dlga_lord_respond_to_insult:lord_pretalk|Ха! Мне нравятся острые языки. Возможно, когда-нибудь я отрежу ваш и буду восхищаться им без лишних хлопот... Но сегодня я не могу не почтить вашей смелости.
dlga_lord_respond_to_insult:lord_pretalk.1|Мадам, не держите на меня зла.
dlga_lord_respond_to_insult:lord_respond_to_insult_challenge_battle|Пытаетесь меня спровоцировать? Имейте в виду: я не держу привычки драться с женщинами, простолюдинами, бунтарями и сумасшедшими. Зато я могу приказать своей челяди взять и выпороть. Хотите?
dlga_lord_respond_to_insult:lord_respond_to_insult_challenge_duel|Пытаетесь меня спровоцировать? Имейте в виду: я не держу привычки драться с женщинами, простолюдинами, бунтарями и сумасшедшими. Впрочем, ваш случай может стать исключением. Ну, несносное дитя, готовы получить заслуженную трепку?
dlga_lord_respond_to_insult:close_window|Пытаетесь меня спровоцировать? Имейте в виду: я не держу привычки драться с женщинами, простолюдинами, бунтарями и сумасшедшими. Сейчас у меня очень хорошее настроение, поэтому я не стану приказывать выпороть вас. Но вы утомили меня, пойдите прочь!
dlga_lord_respond_to_insult_challenge_battle:lord_respond_to_insult_challenge_battle_confirm|бы хотелось посмотреть, что из этого выйдет.
dlga_lord_respond_to_insult_challenge_battle:close_window|Дело не стоит того, чтобы проливать кровь.
dlga_lord_respond_to_insult_challenge_battle_confirm:close_window|Мое терпение лопнуло! Хватай {reg59?её:его}, ребята!
dlga_lord_respond_to_insult_challenge_duel:lord_respond_to_insult_challenge_duel_confirm|Сейчас я преподам вам урок.
dlga_lord_respond_to_insult_challenge_duel:close_window|Дело не стоит того, чтобы проливать кровь.
dlga_lord_respond_to_insult_challenge_duel_confirm:close_window|Да будет так! Защищайтесь!
dlga_lord_quarrel_intervention_1:lord_quarrel_intervention_2|{s14}
dlga_lord_quarrel_intervention_2:lord_quarrel_intervention_3a|А ладно. Похоже, вы правы.
dlga_lord_quarrel_intervention_2:lord_quarrel_intervention_3b|Какие бы ни были ваши разногласия, я больше не желаю о них слышать.
dlga_lord_quarrel_intervention_2:lord_quarrel_intervention_3b.1|Разве вас не убедить уладить ваши разногласия?
dlga_lord_quarrel_intervention_2:lord_pretalk|Если подумать, то я не собираюсь вмешиваться.
dlga_lord_quarrel_intervention_3a:lord_pretalk|Отрадно, что вы так считаете.
dlga_lord_quarrel_intervention_3b:lord_quarrel_intervention_4|Ради нашей дружбы я соглашусь с вами и постараюсь примириться с {s11}.
dlga_lord_quarrel_intervention_3b:lord_pretalk|{s11} останется моим врагом. Я в своем праве.
dlga_lord_quarrel_intervention_4:lord_pretalk|Будем считать, что этой ссоры никогда не было.
dlga_lord_quarrel_intervention_4:lord_pretalk.1|Полагаю, что вам следует поговорить с {s11} и узнать, сделает ли он для меня то же самое.
dlga_lord_internal_politics_cur_stance:lord_internal_politics_cur_stance_plyr_response|Я уже решил{reg59?а:} поддержать вас. 
dlga_lord_internal_politics_cur_stance:lord_internal_politics_cur_stance_plyr_response.1|Я не могу сейчас решить.
dlga_lord_internal_politics_cur_stance:lord_internal_politics_cur_stance_plyr_response.2|Я уже решил{reg59?а:} поддержать {s15}. {s10}
dlga_lord_internal_politics_cur_stance_plyr_response:lord_internal_politics_plyr_choose_candidate|Позвольте сказать, кого поддерживаю я...
dlga_lord_internal_politics_cur_stance_plyr_response:lord_internal_politics_cur_stance_plyr_response|ЧИТ -- В поддержке отказано
dlga_lord_internal_politics_plyr_choose_candidate:lord_internal_politics_plyr_choose_candidate_select|Кого вы поддерживаете?
dlga_lord_internal_politics_plyr_choose_candidate_select:lord_internal_politics_pretalk|Я хочу выдвинуть свою кандидатуру.
dlga_lord_internal_politics_plyr_choose_candidate_select:lord_internal_politics_pretalk.1|Думаю, мой муж {s4}, я всегда за него.
dlga_lord_internal_politics_plyr_choose_candidate_select:lord_internal_politics_support_acknowledge|Я поддерживаю вас, {s4}
dlga_lord_internal_politics_plyr_choose_candidate_select:lord_internal_politics_support_same_acknowledge|Пожалуй, я соглашусь с вами, {s4}
dlga_lord_internal_politics_plyr_choose_candidate_select:lord_pretalk|Ничего.
dlga_lord_internal_politics_support_acknowledge:lord_pretalk|Вы очень великодушны, но мне не нужно этого. Мне придется отказаться от вашей поддержки.
dlga_lord_internal_politics_support_acknowledge:lord_pretalk.1|Я вам не доверяю, и поддержка ваша мне не нужна. Быть вам обязанным -- это очень обременительно и опасно. 
dlga_lord_internal_politics_support_acknowledge:lord_pretalk.2|Вы очень великодушны. 
dlga_lord_internal_politics_support_same_acknowledge:lord_pretalk|Скажите ему об этом сами. Я вам не доверяю и не желаю участвовать в ваших играх. 
dlga_lord_internal_politics_support_same_acknowledge:lord_pretalk.1|Учитывая ваши отношения с {s4}, не думаю, что он будет рад вашей поддержке.
dlga_lord_internal_politics_support_same_acknowledge:lord_pretalk.2|Я расскажу об этом {s4}. Несомненно, он будет благодарен вам за поддержку. 
dlga_lord_internal_politics_plyr_choose_candidate_select:lord_internal_politics_pretalk.2|Я поддерживаю {s4}.
dlga_lord_internal_politics_pretalk:lord_internal_politics_cur_stance_plyr_response|Да. Весьма интересно.
dlga_lord_internal_politics_cur_stance_plyr_response:lord_internal_politics_plyr_request_support|Могу я вместо этого попросить вас поддержать меня?
dlga_lord_internal_politics_cur_stance_plyr_response:lord_pretalk|Впрочем, пока достаточно политики.
dlga_lord_internal_politics_plyr_request_support:lord_pretalk|Вы -- источник разногласий, а потому сейчас не можете считаться достойным кандидатом. Советую вам немного подождать, прежде чем искать дополнительных почестей.
dlga_lord_internal_politics_plyr_request_support:lord_pretalk.1|Извините. Мне не бы хотелось обострять свои отношения с {s4}
dlga_lord_internal_politics_plyr_request_support:lord_pretalk.2|Я бы сказал, что вас и так уже наградили имением под стать вашим заслугам.
dlga_lord_internal_politics_plyr_request_support:lord_pretalk.3|Мне кажется, вам нужно еще показать себя, прежде чем претендовать на такую должность.
dlga_lord_internal_politics_plyr_request_support:lord_pretalk.4|Хмм... Вы просите слишком многое, учитывая наши отношения.
dlga_lord_internal_politics_plyr_request_support:lord_pretalk.5|Я с удовольствием поддержу вас.
dlga_lord_recruit_1_relation:lord_pretalk|Я не слишком жалую разговоры о политике. Может, в другой раз.
dlga_lord_recruit_1_relation:lord_pretalk.1|{s12}
dlga_lord_recruit_1_relation:lord_recruit_pretender|Вы подняли восстание во славу {s16}, а теперь собираетесь просить за {reg3?нее:него}?
dlga_lord_recruit_pretender:lord_recruit_3_dilemma_1|Именно так.
dlga_lord_recruit_pretender:lord_recruit_1_relation|Это не так. Я здесь не для этого.
dlga_lord_recruit_1_relation:lord_pretalk.2|{s12}
dlga_lord_recruit_1_relation:lord_recruit_2|{s12}
dlga_lord_recruit_2:lord_recruit_2_philosophy|А что вы вообще думаете о правителях, знати и политике?
dlga_lord_recruit_2:lord_spouse_leave_faction|Муж мой, я считаю, что вам стоит пересмотреть свое отношение к {s11}.
dlga_lord_spouse_leave_faction:lord_spouse_leave_faction_2|Я не видел от {s9} ничего кроме доброты и справедливости, однако я вас выслушаю. Что вы предлагаете?
dlga_lord_spouse_leave_faction:lord_spouse_leave_faction_2.1|Я не вижу причин оставлять {s9}, но мне бы хотелось послушать, что вы предлагаете.
dlga_lord_spouse_leave_faction:lord_spouse_leave_faction_2.2|Да уж. Оставаться под властью {s9} очень непросто. Так что вы предлагаете?
dlga_lord_spouse_leave_faction_2:lord_spouse_leave_faction_husband_king|Муж мой, я полагаю, что именно вы должны стать правителем!
dlga_lord_spouse_leave_faction_2:lord_spouse_leave_faction_proclaim_queen|Я -- законная правительница северных земель.
dlga_lord_spouse_leave_faction_2:lord_pretalk|Ничего.
dlga_lord_spouse_leave_faction_husband_king:lord_pretalk|Возможно, жена моя, когда-нибудь так и случится, но прежде чем объявлять себя правителем, бы хотелось, чтобы у кого-нибудь из нас была крепость, которая могла бы стать нашим двором.
dlga_lord_spouse_leave_faction_proclaim_queen:lord_pretalk|Я не против ваших притязаний, моя жена, но бы хотелось, чтобы у нас была крепость, которая могла бы стать нашим двором до того, как мы объявим о своих намерениях.
dlga_lord_spouse_leave_faction_proclaim_queen:lord_spouse_leave_faction_proclaim_queen_confirm|{s11}
dlga_lord_spouse_leave_faction_proclaim_queen:lord_pretalk.1|{s11}
dlga_lord_spouse_leave_faction_proclaim_queen_confirm:close_window|Муж мой, я готова ступить на путь, ведущий к престолу.
dlga_lord_spouse_leave_faction_proclaim_queen_confirm:lord_pretalk|Пожалуй, я еще не готова.
dlga_lord_spouse_leave_faction_husband_king:lord_pretalk.1|Возможно, но для подобных притязаний мне потребуется вся ваша поддержка. Впрочем, сначала разберитесь с бунтом {s4}, а потом будем обсуждать наши дальнейшие планы.
dlga_lord_spouse_leave_faction_husband_king:lord_spouse_leave_faction_husband_king_2|В этих землях большая часть знатных семейств так или иначе способна предъявить права на трон... Учитывая, как передается власть в последнее время, у меня не меньше прав называться правителем, чем у {s4}.
dlga_lord_spouse_leave_faction_husband_king_2:lord_spouse_leave_faction_husband_king_3|Как правитель я буду считаться с вашим мнением, выбирая советников, проводя внешнюю политику и во всех остальных делах государства. 
dlga_lord_spouse_leave_faction_husband_king_3:close_window|Прекрасно, муж мой. Сейчас самое время заявить о ваших правах на престол. 
dlga_lord_spouse_leave_faction_husband_king_3:lord_pretalk|Вообще-то лучше немного повременить.
dlga_lord_recruit_2_philosophy:lord_recruit_2|{s43} Хотите поговорить о чем-нибудь другом?
dlga_lord_recruit_2:lord_recruit_2_discontent|Что вы думаете о {s15}?
dlga_lord_recruit_2:lord_recruit_3_a|Помните, о чем мы с вами говорили?
dlga_lord_recruit_2:lord_recruit_quarrel_describe|Ходят слухи, что вы повздорили с {s16}.
dlga_lord_recruit_quarrel_describe:lord_recruit_2|Это не секрет. {s14}
dlga_lord_recruit_2:lord_pretalk|Ничего.
dlga_lord_recruit_2_discontent:lord_recruit_2_discontent_b|{s12}
dlga_lord_recruit_2_discontent:lord_recruit_hesitant|{s12}
dlga_lord_recruit_2_discontent_b:lord_recruit_3|Иногда я беспокоюсь о положении вещей в стране.
dlga_lord_recruit_hesitant:lord_recruit_hesitant_persuade|Может быть, вы сможете рассказать какие-то подробности?
dlga_lord_recruit_hesitant:lord_pretalk|Да, хорошо.
dlga_lord_recruit_hesitant_persuade:lord_recruit_3|Если уж об этом зашла речь, следует признаться, меня тоже иногда беспокоит положение дел в нашей державе.
dlga_lord_recruit_hesitant_persuade:lord_pretalk|Вы испытываете мое терпение. Сказано же, что мне добавить нечего.
dlga_lord_recruit_3:lord_recruit_3_a|Что ж, мне есть, что вам сказать.
dlga_lord_recruit_3:lord_pretalk|Хм, интересно. Впрочем, довольно говорить о политике.
dlga_lord_recruit_3_a:lord_recruit_3_reset_claim|{s12}
dlga_lord_recruit_3_reset_claim:lord_recruit_3_claim|Да, именно так.
dlga_lord_recruit_3_reset_claim:lord_recruit_3_a_reset|Позвольте мне выразиться несколько точнее.
dlga_lord_recruit_3_a:lord_recruit_3_b|Да?
dlga_lord_recruit_3_a_reset:lord_recruit_3_b|Да?
dlga_lord_recruit_3_b:lord_recruit_3_why|Я хочу стать правителем Северных Земель и прошу вас помочь мне в этом.
dlga_lord_recruit_3_b:lord_recruit_3_why.1|Я прошу вас присягнуть на верность {s45}, как правителю Северных Земель.
dlga_lord_recruit_3_b:lord_pretalk|Забудьте.
dlga_lord_recruit_3_dilemma_1:lord_recruit_3_dilemma_2|{s43}
dlga_lord_recruit_3_dilemma_2:lord_recruit_3_why|{s43}
dlga_lord_recruit_3_why:lord_pretalk|Никто из нас не столь силен, как одна крепость под нашим именем. Или вы хотите чтобы вашим королевством управляло логово преступников в лесу?
dlga_lord_recruit_3_why:lord_recruit_3_d|С чего мне поддерживать {s44}?
dlga_lord_recruit_3_d:lord_recruit_3_claim|{s43}
dlga_lord_recruit_3_d:lord_recruit_3_claim.1|Будучи {s47}, {s45} бы {reg59?судила:судил} всех по справедливости и уважал права простых людей.
dlga_lord_recruit_3_d:lord_recruit_3_claim.2|Будучи {s47}, {s45} бы {reg59?уважала:уважал} древние права знати этих земель.
dlga_lord_recruit_3_d:lord_recruit_3_claim.3|Потому что {s45} {reg3?смогу сплотить:сможет сплотить} Северные Земли и положить конец распрям.
dlga_lord_recruit_3_d:lord_recruit_3_claim.4|Потому что {s45} {reg3?награжу:наградит} вас наделами.
dlga_lord_recruit_3_d:lord_pretalk|Забудьте.
dlga_lord_recruit_3_claim:lord_recruit_3_claim|Может, вы скажете всем в округе то, что по-вашему они хотят услышать больше всего? {s12}
dlga_lord_recruit_3_claim:lord_recruit_4|{s12}
dlga_lord_recruit_3_claim:lord_pretalk|{s12}
dlga_lord_recruit_4:lord_recruit_4_objective_conditions|Я прошу вас принести {s16} клятву верности.
dlga_lord_recruit_4:lord_pretalk|Забудьте.
dlga_lord_recruit_4_objective_conditions:lord_recruit_5_security|Дайте подумать...
dlga_lord_recruit_5_security:lord_recruit_5_political|{s32}
dlga_lord_recruit_5_political:lord_recruit_5_ideological|{s31}
dlga_lord_recruit_5_ideological:lord_recruit_5_change_sides|{s33}
dlga_lord_recruit_5_change_sides:lord_recruit_6|{s34}
dlga_lord_recruit_6:lord_recruit_6_reaction|Пришла пора принять решение.
dlga_lord_recruit_6:lord_pretalk|Не обязательно решать прямо сейчас, мы можем вернуться к этому разговору позже.
dlga_lord_recruit_6_reaction:lord_recruit_7_decision|Хорошо...
dlga_lord_recruit_7_decision:lord_pretalk|{s12}
dlga_lord_recruit_7_decision:lord_recruit_pledge|Будь по-вашему! Я присягну на верность {playername}.
dlga_lord_recruit_pledge:lord_recruit_pledge|Помните, вы обещали мне земли. Я не забуду этого.
dlga_lord_recruit_pledge:lord_recruit_pledge_conclude|Да будет так! Я приношу вам клятву верности как преданный вассал. Стану сражаться с вашими врагами там, где потребуется мой меч. Буду стоять за ваши притязания и поддерживать ваших законных наследников. Взамен я ожидаю покровительства и признания моих вассальных прав.
dlga_lord_recruit_pledge:lord_recruit_pledge_conclude.1|Да будет так! Можете известить {s4}, что я приношу {reg4?ей:ему} клятву. Я стану сражаться с {reg4?ее:его} врагами там, где потребуется мой меч и мои люди. Буду стоять за {reg4?ее:его} притязания и поддерживать законных наследников. Взамен я ожидаю покровительства и признания моих вассальных прав.
dlga_lord_recruit_pledge_conclude:close_window|Это очень важное решение... Теперь мне надо удалиться: для подготовки к грядущим переменам, потребуется некоторое время.
dlga_lord_talk:denounce_lord_results|{s4} получил обвинения, как вы и хотели.
dlga_denounce_lord_results:lord_pretalk|Да. Надеюсь, что теперь {s4} дважды подумает, прежде чем даровать наделы, титулы и почести этой змее. Мы вам благодарны.
dlga_denounce_lord_results:close_window|Охотно вам верю. А мы слышали, что он вынудил вас забрать свои слова обратно, и теперь выглядит еще увереннее, чем прежде. Простите меня, {reg59?леди:сир}, если мои слова благодарности кажутся вам недостаточно искренними.
dlga_lord_talk:lord_quest_intrigue_result|По вашей просьбе {s5} теперь знает об исходящей от {s4} опасности.
dlga_lord_quest_intrigue_result:lord_pretalk|Да, мы слышали. Надеюсь, что теперь {s4} дважды подумает, прежде чем даровать пригретой змее наделы, титулы и почести. Мы вам благодарны.
dlga_lord_quest_intrigue_result:close_window|Это мы слышали -- но увы, похоже, что это прошло мимо ушей {s5}. Все же, мы благодарны за вашу попытку.
dlga_lord_talk:lord_lend_companion_end|{s14} -- мой человек, и мне бы хотелось получить {reg3?ее:его} обратно, {s65}, если вы больше не нуждаетесь в {reg3?ее:его} услугах.
