
dlga_maelbresail_aftermorrigan2:maelbresail_aftermorrigan3|А вы честолюбивы, {reg59?милая:друг мой}, но поверьте мне, вам очень хорошо заплатили. Я плачу то, что вы заслужили.
dlga_maelbresail_aftermorrigan2_1:maelbresail_aftermorrigan3|И это очень важно для меня. В нашем мире, не так то просто найти таких исполнительных людей.
dlga_maelbresail_aftermorrigan2_2:maelbresail_aftermorrigan3|Я знаю. Но не все покровители вознаграждают своих подданных так, как я. Хотя порой трудно разобрать: вы преданны мне или моему золоту.
dlga_maelbresail_aftermorrigan2_3:maelbresail_aftermorrigan3|Вам было поручено сделать дело, и вы согласились его выполнить. Никто не заставлял вас соглашаться. Тогда к чему все это нытье? Я не терплю слабохарактерных людей.
dlga_maelbresail_aftermorrigan3:maelbresail_aftermorrigan4|--Он смеется.--^^Я слышал, что Морриган пыталась спасти свою жизнь ложью. Какими были ее последние слова?
dlga_maelbresail_aftermorrigan4:maelbresail_aftermorrigan5|Она сказала, что была последней из рода Флахартаха.
dlga_maelbresail_aftermorrigan4:maelbresail_aftermorrigan5_2|Она умерла прежде, чем я смог{reg59?ла:} поговорить с ней.
dlga_maelbresail_aftermorrigan5:maelbresail_aftermorrigan6|Работая на Аэда мак Нейла, вы послали меня уничтожить остатки семьи Флахартаха, ради устранения потенциальных соперников за трон.
dlga_maelbresail_aftermorrigan5_2:maelbresail_aftermorrigan6|Ложь! Я знаю, когда лгут. Лжецам не место рядом со мной, обычно они весят на виселице!
dlga_maelbresail_aftermorrigan6:maelbresail_aftermorrigan7|Вы принесли огромную пользу Ирландии, если вы еще не в курсе. Остров населен многочисленными кланами, но каждый считает себя вправе властвовать над другими. Основа власти -- слабые служат сильным, и на верху самый сильный –- он и есть Верховный Король Ирландии. Однако, элементы этой лестницы, от малого до великого, постоянно меняются, кто-то становиться сильнее, чем был раньше, заключив союз, например, с таким же слабым, как и он. И их интересы возрастают, в соответствии с продвижением по той самой лестнице, но на ней не так много места, а точнее -- земли не бескрайни, а делить их надо. Вот и снова начинаются конфликты, для избежания которых приходится предпринимать разного рода действия. В общем, очень сложно управлять этой страной.
dlga_maelbresail_aftermorrigan7:maelbresail_aftermorrigan8|Я верю Аэду мак Нейлу, как и он мне, поддерживая мои интересы, а соответственно и ваши. Аэд -- хороший господин. Однако, династии Уи Нейлов очень любили Флахартаха, и его смерть стала для них большой трагедией. Даже сейчас его наследники могут с легкостью призвать эти династии взяться за оружие, и тогда внутри страны снова начнется борьба за власть в Таре. А междоусобная война в Королевстве Айлех только на пользу нашим внешним врагам. Верховный Король Аэд мак Нейл -- сильнейший лидер, и он единственный, кого опасаются Викинги. Он должен быть у власти, понимаете?
dlga_maelbresail_aftermorrigan8:maelbresail_aftermorrigan9_1|Нет никакой необходимости оправдывать свои действия предо мной.
dlga_maelbresail_aftermorrigan8:maelbresail_aftermorrigan9_2|Я терпеть не могу политику.
dlga_maelbresail_aftermorrigan8:maelbresail_aftermorrigan10|Конечно.
dlga_maelbresail_aftermorrigan9_1:maelbresail_aftermorrigan10|Я оправдываюсь? Нет, я рад этому.
dlga_maelbresail_aftermorrigan9_2:maelbresail_aftermorrigan10|Политика -- это то, что движет миром, а также игра, в которую вы либо играете, либо умираете.
dlga_maelbresail_aftermorrigan10:maelbresail_aftermorrigan11|Все, что я делал -- было на благо Ирландии. Если бы я напрямую напал на наследников Флахартаха, то они бы стали мучениками, северные династии могли бы выступить против Короля, под этим предлогом. А теперь, никто не сможет утверждать, что в этом замешан я, так как вы не из моих людей. Вы и настоятель -- очередные злоумышленники, которых я знать не знаю. А ваше имя теперь –- детоубийца Флахартахов.
dlga_maelbresail_aftermorrigan11:maelbresail_aftermorrigan12|Вы отрекаетесь от меня? После того, что я для вас сделал{reg59?а:}?
dlga_maelbresail_aftermorrigan11:maelbresail_aftermorrigan12_2|Мне нужно больше денег, или все узнают о вашем участии.
dlga_maelbresail_aftermorrigan11:maelbresail_aftermorrigan12_3|Предатель! Вы выйдете сухим из воды, в то время как меня будут ненавидеть все Лорды! (Интеллект)
dlga_maelbresail_aftermorrigan11:maelbresail_aftermorrigan12_4|Я огорчу вас, Морриган все еще жива.
dlga_maelbresail_aftermorrigan12:maelbresail_aftermorrigan13|Я ничего не обещал вам. Данное дело было важно для Ирландии. Теперь же, я лишь помогу вам покинуть этот остров. Здесь многие будут ненавидеть вас за убийство наследников Флахартаха. Не в моих правилах отказываться от любого, кто послужил мне верой и правдой, даже если это наемник. Готов вознаградить вас, 50000 шиллингов должны помочь начать новую жизнь подальше отсюда.
dlga_maelbresail_aftermorrigan12_2:maelbresail_aftermorrigan13|Хм... Ну, понимаю. И думаю, что могу заплатить за ваше молчание. Как насчет 100000 шиллингов? Это поможет вам устроить новую жизнь подальше отсюда.
dlga_maelbresail_aftermorrigan12_3:maelbresail_aftermorrigan13|А вы умнее, чем может показаться. Не буду лгать, вы правы, многие Лорды внесут вас в список своих врагов, но это было все во благо Ирландии. Тем не менее, я готов вознаградить вас, 70000 шиллингов должны помочь вам начать новую жизнь подальше отсюда.
dlga_maelbresail_aftermorrigan12_4:maelbresail_aftermorrigan13|Ах. Я понимаю, вы взволнованы и будете пытаться запугать меня. Знаю, что Морриган больше не угроза для нас. Вы должны покинуть Ирландию, как можно быстрее, я дам вам 30000 шиллингов, чтобы начать новую жизнь подальше отсюда.
dlga_maelbresail_aftermorrigan13:maelbresail_aftermorrigan14|Полагаю, у меня нет выбора. Я возьму деньги и покину этот остров.
dlga_maelbresail_aftermorrigan13:maelbresail_aftermorrigan14.1|Давайте сюда деньги, потом узнаете, что я сделаю.
dlga_maelbresail_aftermorrigan13:maelbresail_aftermorrigan15|Оставьте деньги себе, мне нужно очистить свое имя.
dlga_maelbresail_aftermorrigan14:close_window|Хорошо. У меня нет такой суммы здесь. Возле города Тара у меня есть ферма, там и встретимся для передачи денег. Там же я хочу еще устроить празднество в вашу честь, ведь мы более не встретимся с вами. Прощайте, {playername}.
dlga_maelbresail_aftermorrigan15:close_window|Понимаю. Для достижения больших высот нужно обладать честью, а не запятнанным кровью именем. Я согласен, и помогу вам очистить ваше имя, ведь я имею большое влияние в Ирландии. Для этого мне придется потратить все деньги, что я вам обещал. И надо придумать план, как все это осуществить. Возле города Тара у меня есть ферма, там я устрою празднество в вашу честь, на котором мы и переговорим о том, как вам помочь, {playername}.
dlga_maelbresail_pactofinal:maelbresail_pactofina2|Признаю, вы превзошли все мои ожидания. Вы слишком опасны, чтобы иметь вас в качестве врага. Я предлагаю здесь и сейчас заключить между нами мир. Я заплачу 50000 шиллингов за все, что случилось с вами из-за меня, и после наши пути никогда не пересекутся. Вы не будете преследовать меня, а я не буду посылать людей, чтобы убить вас. Все будет так, как будто мы никогда не знали друг друга. Клянусь именем матери при всех свидетелях, присутствующих здесь. Вы согласны?
dlga_maelbresail_pactofina2:maelbresail_pactofina3_1|Хорошо, мы оба деловые люди. Я принимаю деньги, и вы никогда больше не услышите обо мне.
dlga_maelbresail_pactofina2:maelbresail_pactofina3_2|Я соглас{reg59?на:ен}, но хочу обменять деньги на услугу Верховного Короля Аэда мак Нейла.
dlga_maelbresail_pactofina2:maelbresail_pactofina3_3|Думаю, что нет. За кровь платят кровью. Твои дни сочтены.
dlga_maelbresail_pactofina3_1:maelbresail_pactofina5|Нет! Моя семья требует мести из своих могил. Сегодня прольется кровь!^^Помнишь меня, Маэл Бресал? Ты помнишь меня, крыса? Я пришла убить тебя!
dlga_maelbresail_pactofina3_2:maelbresail_pactofina5|Нет! Моя семья требует мести из своих могил. Сегодня прольется кровь!^^Помнишь меня, Маэл Бресал? Ты помнишь меня, крыса? Я пришла убить тебя!
dlga_maelbresail_pactofina3_1:maelbresail_pactofina3_6|Вот ваши деньги. Если мы когда-нибудь снова встретимся, то я не знаю вас, а вы не знаете меня. Наши дела окончены. Нет больше страха, нет больше смерти. Уговор скреплен золотой печатью, и пусть Бог будет свидетелем наших клятв.
dlga_maelbresail_pactofina3_2:maelbresail_pactofina3_6|Хорошо, это справедливо. Я сделаю все возможное, чтобы мой Король относился к вам лучше, чем к своим самым верным вассалам. Если мы когда-нибудь снова встретимся, то я не знаю вас, а вы не знаете меня. Наши дела окончены. Нет больше страха, нет больше смерти. Уговор скреплен золотой печатью, и пусть Бог будет свидетелем наших клятв.
dlga_maelbresail_pactofina3_6:maelbresail_pactofina3_7|Клянусь. Наша вражда окончена.
dlga_maelbresail_pactofina3_7:close_window|Клянусь именем матери. Идите с миром. Вы теперь богатый человек.
dlga_maelbresail_pactofina3_3:maelbresail_pactofina4|Я вижу, что ты воин и не в состоянии видеть очевидное из-за отблеска стали, так пусть ее будет больше. Из нас двоих уйдет только один. Воины, ко мне!
dlga_maelbresail_pactofina4:maelbresail_pactofina5|Помнишь меня, крыса? Я пришла убить тебя и отомстить за свою семью!
dlga_maelbresail_pactofina4:maelbresail_pactofina5_2|Пришло время встретиться с создателем!
dlga_maelbresail_pactofina5:close_window|--Его лицо краснеет от злости.--^^Ты? Но... Убейте их, убейте их всех!
dlga_maelbresail_pactofina5_2:close_window|Убить их, убить их всех!
dlga_start:thesnake1_dialog|Вы похоже на воина. Вам нужна работа?
dlga_thesnake1_dialog:thesnake2_dialog|Я знаю, кто вы. Они зовут вас 'Змей'. Меня послали убить вас.
dlga_thesnake1_dialog:thesnake2_1_dialog|Змей, боюсь я здесь не для того, чтобы вступить в ваши ряды.
dlga_thesnake1_dialog:thesnake2_2_dialog|Конечно, Змей, сколько вы платите?
dlga_thesnake2_dialog:thesnake3_dialog|Почему? Ах да, я понимаю. Не буду прятаться. В городе есть место для местных соревнований. Я буду ждать вас там со своими лучшими людьми. Приходите и приводите с собой самых преданных спутников. Мы будем сражаться!
dlga_thesnake2_1_dialog:thesnake3_dialog|Только враги называют меня 'Змей'. Я та свободная нить, что некоторые хотят оборвать. Я представляю опасность для одной Крысы -- твоего покровителя. Жалкий трус, он даже сам не осмелился прийти ко мне, а подослал убийцу. Не буду прятаться. В городе есть место для местных соревнований. Буду ждать вас там со своими лучшими людьми. Приходите и приводите с собой самых преданных спутников. Мы будем сражаться!
dlga_thesnake2_2_dialog:thesnake3_dialog|Только враги называют меня 'Змей'. Те самые, что убили мою семью. Вы пришли убить меня? Не буду прятаться. В городе есть место для местных соревнований. Буду ждать вас там со своими лучшими людьми. Приходите и приводите с собой самых преданных спутников. Мы будем сражаться!
dlga_thesnake3_dialog:close_window|Договорились. Мы придем.
dlga_thesnake3_dialog:thesnake4_dialog|Эээ... Минутку.
dlga_thesnake4_dialog:close_window|Нет! Вам нужна моя голова, так хоть имейте мужество заполучить ее.^^[Ваши спутники присоединяются к вам в этом поединке]
dlga_start:morrigan1_dialog|Вы пришли убить меня? Ваш Лорд, Маэл Бресал, был бы счастлив покончить с моим родом.
dlga_start:morriganleave_final1|{playername}, я хочу вас поблагодарить за все, что вы сделали для меня. Без вас я бы не смогла отомстить за свою семью. Ох, смерть Маэла Бресала не принесла мне радости, но я чувствую, что поступила правильно. Моя семья может теперь покоится с миром. Мое путешествие с вами окончено. Я покидаю вас, мне нужно найти себе новое место в мире, подальше от Ирландии, где прошлое не будет тяготить, где я смогу начать новую жизнь и оставить прошлое позади. А вы часть моего прошлого, поэтому я ухожу от вас.
dlga_morrigan1_dialog:morrigan1_dialog1|Настал твой конец, ведьма! Я убью тебя!
dlga_morrigan1_dialog:morrigan1_dialog2|О чем ты говоришь, ведьма?
dlga_morrigan1_dialog:morrigan1_dialog3|Маэл Бресал мне не Лорд.
dlga_morrigan1_dialog1:close_window|Мой отец, Флахартах, мог стать Королем, но был убит своим собственным братом, Аэдом из Айлеха, и его помощником -- Маэлом Бресалом. Вы собираетесь убить последнего члена из нашего древнего рода. Боги и люди будут проклинать ваше имя.^^Долго время у меня не было ничего, кроме своей собственной жизни. Но я не боюсь смерти, осточертела такая жизнь, хватит мучений и жизни в страхе.^^(Вы не успеваете даже ответить, как Морриган сама бросается на ваш меч, готовая к тому, что холодная сталь пронзит ее тело. Она молчит. Вы смотрите ей в глаза и видите спокойствие...)
dlga_morrigan1_dialog2:morrigan1_dialog4|Ты убиваешь не зная кого и за что?
dlga_morrigan1_dialog3:morrigan1_dialog4|Тогда почему ты работаешь на проклятого Лорда и его жалкого Короля Аэда, и убиваешь не угодных им людей?
dlga_morrigan1_dialog4:morrigan1_dialog5|{s10}
dlga_morrigan1_dialog5:morrigan1_dialog6|Бал Лейни? Я могла бы давно уничтожить деревню, но никогда бы не сделала этого. Я просто запугивала местных жителей, чтобы они покинули эти земли и оставили деревню, где я бы обустроила свою жизнь, и, возможно, чувствовала бы себя более защищенной. Но эти крестьяне упрямые овцы, от них Маэл Бресал и узнал о моем местонахождении. Затем он прислал вас покончить со мной и моим родом раз и навсегда. Маэл Бресал -- жесточайший человек. Недавно он послал людей в Шотландию убить моего брата и его сыновей, совсем еще детишек, возле Мейфода. Сейчас, я последняя, кто остался из моей семьи, и вижу, что от этого человека невозможно скрыться. Я ушла в отдаленное, богами забытое место, забыла свое имя, приняла новое обличье, но тем не менее вы здесь, и готовы оборвать мою жизнь.
dlga_morrigan1_dialog6:morrigan1_dialog1|Лгунья! Ты пытаешься меня запутать. Пришло твое время умереть.
dlga_morrigan1_dialog6:morrigan1_dialog7|Так значит... Ты наследница Флахартаха? Неудивительно, что ты угроза кое для кого!
dlga_morrigan1_dialog7:morrigan1_dialog8|Моим отцом был Флахартах, и он мог стать Королем, но был убит своим собственным братом, Аэдом из Айлеха, и его помощником -- Маэлом Бресалом! Такая она -- Ирландия. Хотите восседать на троне? Тогда покончите с теми, кто тоже имеет на это право. Все это приводит к братоубийству и считается уже в порядке вещей. Аэд был быстрее и хитрее моего отца, и быстро расправился с ним, а его помощник, Маэл, убил мою мать и всю мою семью. Успели сбежать лишь я и мой брат с сыновьями, но все бесполезно. Осталась только я, и то нахожусь на острие вашего меча.
dlga_morrigan1_dialog8:morrigan1_dialog1|Все равно, ты причинила вред жителям Бал Лейни и заплатишь за это жизнью.
dlga_morrigan1_dialog8:morrigan1_dialog9|Выходит, Маэл Бресал использовал меня? Я не его наемный убийца!
dlga_morrigan1_dialog9:morrigan1_dialog1|Ну, это меня не касается. Я устала бежать в никуда. Все, кто мне дороги -- мертвы. Я встречусь с ними в другом мире. Возвращайтесь к своем хозяину и получите награду, убийца. Вам не позавидуешь...
dlga_morrigan1_dialog9:morrigan1_dialog10|Маэл Бресал использует всех, вы не первый. И что вы предпримите теперь?
dlga_morrigan1_dialog10:morrigan1_dialog1|Вы причиняли вред жителям Бал Лейни и заплатите за это жизнью.
dlga_morrigan1_dialog10:morrigan1_dialog11|Я позволю вам жить, пока не получу кое-какие ответы от Маэла Бресала. Я скоро вернусь.
dlga_morrigan1_dialog11:close_window|Я лучше пойду с вами, у меня нет никого, вы убили последних моих сторонников. И мне, честно говоря, надоело скрываться. Просто в вашем отряде появиться еще один воин, никто и не заметит меня среди ваших людей.
dlga_morriganleave_final1:morriganleave_final2|Понимаю. Надеюсь, вы найдете мир, в который хотели попасть.
dlga_morriganleave_final1:morriganleave_final3|Морриган, вы не можете оставить меня, вы мне нужны.
