
dlga_start:blocked_agent|Похоже, этот человек занят. Нужно идти дальше.
dlga_blocked_agent:close_window|Простите, что потревожил вас.
dlga_blocked_agent:close_window.1|[Уйти]
dlga_start:dog_talk_2|{s1}!
dlga_dog_talk_1:dog_talk_2|{s1}!
dlga_dog_talk_2:close_window|К ноге!
dlga_dog_talk_2:close_window.1|Вперед, {s1}, вперед!
dlga_dog_talk_2:close_window.2|{s1}, стой!
dlga_dog_talk_2:dog_talk_pretrain|Эй, у меня для тебя кое-что есть...
dlga_dog_talk_2:close_window.3|Я назову тебя...
dlga_dog_talk_2:close_window.4|Чертова псина! Убирайся! Ты мне больше не нужна!
dlga_dog_talk_2:close_window.5|Фу! Оставь!
dlga_start:dog_talk_recruit|   
dlga_dog_talk_recruit:dog_talk_1|Вот, держи колбаску!
dlga_dog_talk_recruit:close_window|Хороший пёс!
dlga_dog_talk_recruit:close_window.1|Прочь!
dlga_dog_talk_pretrain:dog_talk_train|Эй, у меня есть кое-что для тебя...
dlga_dog_talk_train:dog_talk_pretrain|Что-то ты у меня плоховато выглядишь. Держи {s7}, это тебе!
dlga_dog_talk_train:dog_talk_pretrain.1|Лови {s7}, теперь ты наберешься сил!
dlga_dog_talk_train:dog_talk_pretrain.2|Я хочу, чтобы мой пёс стал злее. Держи {s7}, это пойдет тебе только на пользу!
dlga_dog_talk_train:dog_talk_pretrain.3|Что-то ты у меня похудел, пёс. Держи {s7}, это тебе!
dlga_dog_talk_train:dog_talk_pretrain.4|Что ты еле плетешься? Держи-ка {s7}, это тебе!
dlga_dog_talk_train:dog_talk_pretrain.5|Держи-ка {s7}, это тебе! Чтобы зубы были крепче.
dlga_dog_talk_train:dog_talk_1|Извини, у меня нет для тебя еды.
dlga_dog_talk_train:dog_talk_1.1|Тебе на сегодня хватит.
dlga_start:close_window.1|Вы должны попрощаться с матерью и оставить что-нибудь, что, возможно, ей понадобится по пути в Вальхаллу.
dlga_start:close_window.2|Я жду того, кто придет с девушкой. Видели их?
dlga_start:close_window.3|А, так это вы -- {playername}. Тонкрик говорил мне, что вы скоро появитесь. Прошу на корабль, это чудо доставит вас куда угодно.
dlga_start:port_chief_travel|Приветствую! Хотите отправиться в другой город?
dlga_start:close_window.4|Нужно подождать всех, кто желает отплыть на корабле.
dlga_start:port_chief2|{s1}
dlga_port_chief2:port_chief3|Чего вы хотели?
dlga_port_chief3:port_chief_fleet1|Приветствую. Я здесь, чтобы присоединиться к флоту Свена 'Бычьей Шеи' и Харальда Харальдссона, которые направляются в Англию.
dlga_port_chief3:port_chief_bodoletter1|Недавно в этом порту видели человека по имени Атли Эйрикссон. Знаете куда он направился?
dlga_port_chief3:port_chief_pieles|Моя часть сделки выполнена, теперь слово за вами. Где Атли Эйрикссон?
dlga_port_chief3:port_chief_catach|Я побывал в Глендалохе и достал 'Катах Колума Килле'.
dlga_port_chief3:port_chief_catach32|К сожалению, Глендалох слишком далеко. Может лучше дать вам денег?
dlga_port_chief3:port_chief_svenlair|Вы знаете, что мне нужно. Где скрывается Свен 'Бычья Шея'?
dlga_port_chief3:port_chief_buy_ship|Я хочу купить корабль.
dlga_port_chief_buy_ship:close_window|Следуйте за мной!
dlga_port_chief3:port_chief_info_main|У меня есть пару вопросов: про корабли и морские путешествия.
dlga_port_chief_info_main:port_chief_info_main_1|Что вы хотите знать?
dlga_port_chief_info_main_1:port_chief_info_a_1|Для чего люди отправляются в море?
dlga_port_chief_info_main_1:port_chief_info_b_1|Как прокладывать путь в море?
dlga_port_chief_info_main_1:port_chief_info_c_1|Что нужно знать при покупке корабля?
dlga_port_chief_info_main_1:port_chief_info_d_1|Что нужно, чтобы корабль плыл быстрее?
dlga_port_chief_info_main_1:port_chief2|Это все, что мне нужно было знать, спасибо.
dlga_port_chief_info_a_1:port_chief_info_main|Морем куда быстрее доставлять товары и рабов, если вы торговец, и, соответственно, покорять или грабить поселения, если вы воин. И наконец, ни один Викинг не признает вас как лидера, если у вас не будет хорошего корабля.
dlga_port_chief_info_b_1:port_chief_info_main|Днем ориентируйтесь по солнцу, ночью отдыхайте. И чем выше ваш навык 'Мореходство', тем быстрее вы плывете.
dlga_port_chief_info_c_1:port_chief_info_c_2|Для начала, нужно определить для каких целей вам нужен корабль. Кнорр -- хорош для торговли, вмещает много груза, но не очень быстрое судно. Шнека, Скей и Буссе -- прекрасные быстрые военные корабли, на которых вы перевезете достаточно своих воинов. Корабль Карви -- что-то среднее между упомянутыми выше. И, если у вас небольшой отряд, то вам лучше подойдет соответствующий корабль -- Бурдинг.
dlga_port_chief_info_c_2:port_chief_info_main|Далее, важным моментом при выборе корабля будет то из какой древесины он изготовлен. Дубовые лучше, но дороже. Сосна дешевле, но гниет быстрее.
dlga_port_chief_info_d_1:port_chief_info_main|Ветер! И умение ловить его парусами. Нет ветра, значит гребите, чем больше гребцов, тем быстрее плывешь. Если у вас больше одного корабля, то флот двигается со скоростью самого медленного судна. Навык 'Мореходство' также влияет на скорость корабля.
dlga_port_chief3:port_chief_travel|Мне нужно попасть в другой порт.
dlga_port_chief_travel:close_window|К сожалению, в этом порту нет пассажирских кораблей.
dlga_port_chief_travel:close_window.1|К сожалению, в настоящее время в этом порту нет кораблей, которые могли бы перевезти ваш отряд и торговца с его грузом.
dlga_port_chief_travel:port_chief_travel_2|Отсюда можно добраться до портов Фризии, Дании, Норвегии и Англии. Куда вы хотите попасть?
dlga_port_chief_travel:port_chief_travel_2.1|Отсюда можно добраться до портов Англии и Ирландии. Куда вы хотите попасть?
dlga_port_chief_travel:close_window.2|К сожалению, в этом порту нет пассажирских кораблей.
dlga_port_chief_travel_2:port_chief_travel_3|{s1}
dlga_port_chief_travel_2:close_window|Я передумал.
dlga_port_chief_travel_3:port_chief_travel_4|Вы хотите отправиться в {s1}? {s2}
dlga_port_chief_travel_4:port_chief_travel_5|Вперед!
dlga_port_chief_travel_4:port_chief2|{s1}
dlga_port_chief_travel_4:close_window|{s1}
dlga_port_chief_travel_5:close_window|Следуйте за мной!
dlga_port_chief3:port_chief_pick_up_ship1|Мой корабль уже готов?
dlga_port_chief_pick_up_ship1:port_chief2|Мы работаем над этим. Возвращайтесь через {reg1} дн.
dlga_port_chief_pick_up_ship1:port_chief_pick_up_ship2|Корабль готов! Спустить его на воду?
dlga_port_chief_pick_up_ship2:port_chief_pick_up_ship3|Да!
dlga_port_chief_pick_up_ship2:port_chief2|Нет, пока нет.
dlga_port_chief_pick_up_ship3:port_chief2|К сожалению, ваш навык 'Викинг' не достаточно высок, чтобы добавить корабль к вашему флоту в этом порту.
dlga_port_chief_pick_up_ship3:close_window|Ну, полюбуйтесь на него и дайте ему имя.
dlga_port_chief_pick_up_ship3:port_chief2.1|Нет места в порту для другого корабля.
dlga_port_chief3:port_chief_build_ship_main|Я хочу, чтобы вы построили мне корабль.
dlga_port_chief_build_ship_main:port_chief_build_ship_main_1|Какой?
dlga_port_chief_build_ship_main_1:port_chief_build_ship_main_2|Сойдет небольшой -- Бурдинг.
dlga_port_chief_build_ship_main_1:port_chief_build_ship_main_2.1|Нужен Кнорр, для торговли.
dlga_port_chief_build_ship_main_1:port_chief_build_ship_main_2.2|Нужна Шнека для хороших налетов.
dlga_port_chief_build_ship_main_1:port_chief_build_ship_main_2.3|Интересует военный корабль -- Скей.
dlga_port_chief_build_ship_main_1:port_chief_build_ship_main_2.4|Необходим вместительный корабль -- Буссе.
dlga_port_chief_build_ship_main_1:port_chief_build_ship_main_2.5|Мне нужен разноплановый корабль -- Карви.
dlga_port_chief_build_ship_main_1:port_chief2|Я передумал.
dlga_port_chief_build_ship_main_2:port_chief_build_ship_main|Извините, я не достаточно опытен для строительства корабля такого типа. Только норманны могут построить {s11}.
dlga_port_chief_build_ship_main_2:port_chief_info_main_3|Какую древесину использовать при строительстве корабля?
dlga_port_chief_info_main_3:port_chief_build_ship_main_4|Дуб, нужно качество.
dlga_port_chief_info_main_3:port_chief_build_ship_main_4.1|Пойдет и сосна.
dlga_port_chief_info_main_3:port_chief_build_ship_main_4.2|Денег не много, будем брать ясень.
dlga_port_chief_info_main_3:port_chief2|Я передумал.
dlga_port_chief_build_ship_main_4:port_chief_build_ship_main_5|Строительство корабля {s11} с использованием древесины -- {s12}, будет стоить вам {reg11} шиллингов. {s2}Понадобится {reg12} дн. на постройку короля. 
dlga_port_chief_build_ship_main_5:port_chief_build_ship_main_6|Начинайте строить.
dlga_port_chief_build_ship_main_5:port_chief_build_ship_missing_1|По вашему я похож{reg59?а:} на {reg59?торговку:торговца}, котор{reg59?ая:ый} волочит целый обоз за собой? У меня нет определенных вещей.
dlga_port_chief_build_ship_missing_1:port_chief2|Извините, но тогда я не смогу построить вам корабль. Достаньте все необходимое и возвращайтесь, если вам нужен корабль.
dlga_port_chief_build_ship_main_5:port_chief_build_ship_missing_2|У меня нет пока на это денег.
dlga_port_chief_build_ship_missing_2:port_chief2|Извините, но мне нужно кормить семью и платить работникам. Как накопите необходимую сумму, так и обращайтесь.
dlga_port_chief_build_ship_main_5:port_chief_build_ship_missing_3|Конечно. Возможно, мы скоро вновь с вами увидимся.
dlga_port_chief_build_ship_missing_3:port_chief2|Не торопитесь. И поверьте, моя работа стоит каждого шиллинга, который вы заплатите.
dlga_port_chief_build_ship_main_6:port_chief2|Хорошо! Жду вас через {reg12} дн.
dlga_port_chief3:close_window|Прощайте.
dlga_port_chief_fleet1:port_chief_fleet2|Вижу, вы стали узнаваемы в этих землях, ваше имя звучит на каждом углу. Мне приятно осознавать, что в этом есть и моя заслуга. И как должное, надеюсь, в саге о вас для меня найдется пара строк! Флот Свена и Харальда находится в заливе, он состоит из 50 кораблей, большинство из которых военные, и на них находится более 800 воинов. Вы закончили свои дела в Дании? Готовы покинуть эти места? Гарантирую, вы еще не скоро вернетесь сюда!
dlga_port_chief_fleet2:the_fleetmt1|Да, пора. Принимайте на борт моих людей.
dlga_the_fleetmt1:close_window|Ну, удачи вам! Да, здесь много кораблей, но большая часть флота в заливе, недалеко от города. Как только вы будете готовы присоединяйтесь к ним.
dlga_port_chief_fleet2:port_chief2|Позже, у меня еще есть кое-какие дела.
dlga_port_chief_catach:port_chief_catach2|{s2}^^Хорошо, дайте мне книгу, и я скажу вам то, что вы хотели знать.
dlga_port_chief_catach2:port_chief_catach31|Вот, держите. А теперь поведайте, где скрывается Свен?
dlga_port_chief_catach2:port_chief_catach32|Эээ, книга утеряна, возможно, вас заинтересует кашель золота взамен нее?
dlga_port_chief_catach32:port_chief_catach4|Мой клиент будет не доволен, и люди будут знать, что вы не надежный человек. Он заплатил мне 10000 шиллингов за книгу. У вас есть такие деньги?
dlga_port_chief_catach4:port_chief_catach5|Да, у меня есть такая сумма. Держите, и говорите, где Свен!?
dlga_port_chief_catach4:port_chief2|Эээ, к сожалению, нет. Я вернусь позже, как только соберу необходимое.
dlga_port_chief_catach5:port_chief_catach5_1|Боже мой, да вы богатый человек! Он скрывается здесь, в Дании, к юго-востоку от Рибе, вверх по реке. 
dlga_port_chief_catach5_1:port_chief2|Спасибо.
dlga_port_chief_catach31:port_chief_catach31_1|Хорошо, спасибо. Он скрывается здесь, в Дании, к юго-востоку от Рибе, вверх по реке. 
dlga_port_chief_catach31_1:port_chief2|Спасибо.
dlga_port_chief_svenlair:port_chief_svenlair2|{s2}^^Потише! Никто в порту не должен знать, о чем мы говорим. Вам посоветовали обратится ко мне, и вы правильно сделали.^^Хорошо, вы хотите знать где можно найти этого человека, но у каждой информации есть своя цена, а учитывая, что Свен 'Бычья Шея' опасный тип, то вам это будет стоить не малых денег.
dlga_port_chief_svenlair2:port_chief_svenlair3|{s2}^^Слушайте внимательно, сейчас мне как раз нужен такой человек, что смог бы совершить налет и добыть мне книгу, которую мне заказал один клиент. Нужно будет оправиться в Ирландию, найти монастырь Глендалох и забрать манускрипт -- 'Катах Колума Килле'. Главное -- это книга, а все, что вы еще прихватите меня не волнует, это останется у вас. Принесете книгу, и я дам вам знать, где искать Свена.
dlga_port_chief_svenlair3:port_chief_svenlair31|Хорошо! Я достану вам книгу, до скрой встречи.
dlga_port_chief_svenlair3:port_chief_svenlair32|Я не убиваю монахов, и не граблю монастыри.
dlga_port_chief_svenlair3:port_chief_svenlair33|Я предпочитаю забыть о книге и предлагаю монеты за информацию.
dlga_port_chief_svenlair31:close_window|Я буду ждать вас здесь. Думаю, вам стоит починить свой или приобрести новый корабль, так как путь в Ирландию не близок. И советую собрать солидный отряд, кто знает, что вас ждет в тех землях. До встречи.
dlga_port_chief_svenlair32:close_window|Тогда просто купите книгу для меня, или придумайте что-нибудь, но доставьте ее мне. Думаю, вам стоит починить свой или приобрести новый корабль, так как путь в Ирландию не близок. И советую собрать солидный отряд, кто знает, что вас ждет в тех землях. До встречи.
dlga_port_chief_svenlair33:port_chief_svenlair4|Хм, не самый удачный вариант для вас. Мне предложили 10000 шиллингов за эту книгу. У вас есть такие деньги?
dlga_port_chief_svenlair4:port_chief_svenlair5|Да, у меня есть такая сумма. Держите, и говорите где Свен!?
dlga_port_chief_svenlair4:port_chief_svenlair31|Нет у меня такой суммы, придется достать книгу. До скорой встречи.
dlga_port_chief_svenlair5:port_chief_svenlair5_1|Боже мой, да вы богатый человек! Он скрывается здесь, в Дании, к юго-востоку от Рибе, вверх по реке. 
dlga_port_chief_svenlair5_1:port_chief2|Спасибо.
dlga_port_chief_bodoletter1:port_chief_bodoletter2|{s2}^^Вы всегда говорите так громко? Ну, вы знаете меня, информация у меня всегда достоверна, но за определенную цену.
dlga_port_chief_bodoletter2:port_chief_bodoletter3|{s2}^^Слушайте внимательно, информация очень ценная. Сейчас речь пойдет о человеке, что считается второй по важности персоной в Дании, имя его -- Сигурд 'Змееглазый'. Как насчет 12000 шиллингов? У вас есть такая сумма? Если нет, то вы можете сделать мне одолжение. Есть человек, которому нужно доставить меха в город Дублин, что в Ирландии. С вас доставка -- с меня информация. Все просто.
dlga_port_chief_bodoletter3:port_chief_bodoletter_pieles|Хорошо, по рукам.
dlga_port_chief_bodoletter3:port_chief_bodoletter4|У меня есть такая сумма, держите. Где он сейчас?
dlga_port_chief_bodoletter3:port_chief_bodoletter7|Мы ведь с вами давно знакомы, практически друзья. А старым деловым партнером можно предложить и скидку, не так ли? 
dlga_port_chief_bodoletter3:port_chief_bodoletter3_1|К сожалению, нет. Я скоро вернусь с деньгами.
dlga_port_chief_bodoletter_pieles:close_window|Довольно болтовни. Отправляйтесь в Дублин и доставьте меха торговцу по имени Хогни. Можете прихватить с собой другие товары, чтобы продать их в тех далеких землях. Как только получите свиток о подтверждении доставки товара можете сразу возвращаться, я вам дам нужную информацию.
dlga_port_chief_bodoletter3_1:port_chief2|Возвращайтесь, когда у вас будут деньги, у меня нет времени на разговоры с нищими.
dlga_port_chief_bodoletter4:port_chief_bodoletter5|Да вы богатый человек! Атли Эйрикссон в Норвегии, так говорил один из его воинов местной счастливой вдове. Очевидно, Атли имеет что-то важное, что никто не должен узнать, раз такая скрытность... Говорят, он в пещере на северном побережье Норвегии, возле Хордаланна. 
dlga_port_chief_bodoletter5:port_chief2|Спасибо.
dlga_port_chief_bodoletter7:port_chief_bodoletter8|Хм, ну, в общем то можно, но не говорите никому о нашей договоренности, иначе моя репутация сильно пострадает. 8000 шиллингов и информация ваша. И так, где деньги?
dlga_port_chief_bodoletter8:port_chief_bodoletter9|Вот, держите. Где он?
dlga_port_chief_bodoletter8:port_chief_bodoletter3_1|К сожалению, у меня столько нет. Я скоро вернусь с деньгами.
dlga_port_chief_bodoletter9:port_chief_bodoletter5|Запомните, больше скидок не будет! Атли Эйрикссон в Норвегии -- так сказал один из его воинов местной счастливой вдове. Очевидно, Атли имеет что-то важное, о чем никто не должен знать, раз такая скрытность... Говорят, он в пещере на северном побережье Норвегии, возле Хордаланна.
dlga_port_chief_pieles:port_chief_bodoletter5|Вести с вами дела одно удовольствие! Атли Эйрикссон в Норвегии -- так сказал один из его воинов местной счастливой вдове. Очевидно, Атли имеет что-то важное, о чем никто не должен знать, раз такая скрытность... Говорят, он в пещере на северном побережье Норвегии, возле Хордаланна.
dlga_start:port_prisoners|Кто вы?
dlga_port_prisoners:port_prisoners_2|Вы ищите работорговца? Эх, {s9}... Город бы не процветал без моих рабов. Есть ли у вас пленники? Я готов их купить.
dlga_port_prisoners_2:port_prisoners_3|Да, у меня есть пленники.
dlga_port_prisoners_2:close_window|Прощайте.
dlga_port_prisoners_3:port_prisoners_4|Приятно это слышать. Пойдемте.
dlga_port_prisoners_4:close_window|Приятно вести с вами дела.
dlga_start:port_r_2|Приветствую! Я бывалый капитан и моя задача -- распределять работы в порту города {s9}. Если вам будут нужны для найма моряки, дайте мне знать.
dlga_port_crew_talk:port_r_2|Чем еще могу быть полезен для вас?
dlga_port_r_2:port_recruitsl|Я хочу нанять моряков.
dlga_port_recruitsl:port_crew_talk|Сейчас нет свободных для найма моряков, возвращайтесь позже, {reg59?госпожа:господин}.
dlga_port_recruitsl:port_crew_talk.1|Сейчас навряд ли кто-то заинтересован в вашем предложении, {reg59?госпожа:господин}. У вас мало места в отряде.
