
dlga_trainer_explain_combat_2:trainer_explain_combat_3|Так вот. Защищаться проще всего, если у тебя есть щит. Просто ставь блок щитом. [Удерживайте правую кнопку мыши, чтобы поставить блок щитом]. В такой ситуации ты сможешь отразить все атаки, идущие спереди. Однако твои фланги и твой тыл по-прежнему неприкрыты.
dlga_trainer_explain_combat_3:trainer_explain_combat_4|Что делать, если у меня нет щита?
dlga_trainer_explain_combat_4:trainer_explain_combat_5|Тогда блокируй оружие соперника собственным оружием. Это немного сложнее, чем защищаться со щитом. Оружием ты можешь поставить блок лишь от ОДНОЙ атаки. То есть, ты ставишь верхний блок, боковые блоки, либо блокируешь выпад. А потому нужно внимательнее следить за соперником: начинай блокировать удар только ПОСЛЕ того, как твой противник начнет атаку. Так ты поставишь нужный для такой атаки блок. Если же ты начнешь ДО того, как начнет движение твой противник, он успеет изменить направление удара, и твой блок не поможет.
dlga_trainer_explain_combat_5:trainer_explain_combat_6|И самое главное. Нападение -- лучшая защита. Многие бойцы предпочитают встать в атакующую стойку и приготовить оружие к удару. Тогда остается дождаться подходящего момента и завершить удар. [Чтобы приготовить оружие к атаке, нажмите и удерживайте левую кнопку мыши.]
dlga_trainer_explain_combat_6:trainer_explain_combat_7|Думаю, мне это пригодится.
dlga_trainer_explain_combat_7:trainer_explain_combat_8|Это хорошая тактика, но помни, твой противник может увидеть это и заранее поставить блок против твоего удара. Если это произойдет, нужно прерывать атаку и быстро атаковать с другого направления. [Чтобы отменить текущую атаку, щелкните правой кнопкой мыши].
dlga_trainer_explain_combat_8:trainer_explain_combat_9|Если мой противник ставит защиту в том направлении, в котором я атакую, я прерываю удар и бью по-другому.
dlga_trainer_explain_combat_9:trainer_pretalk2|Да, выбрать, куда бить -- это важнейшее умение. Основных направлений четыре: удар справа, удар слева, удар сверху и выпад. [По умолчанию, чтобы контролировать направление удара, передвиньте мышь в направлении, с которого нужно начать удар, удерживая левую кнопку мыши].
dlga_trainer_practice_11:trainer_practice_11|Посмотрев, могу сказать, что вижу задатки {reg59?великой воительницы: великого воина} в вас.^^Сейчас пару моих людей, как раз ничем не заняты. Если хотите, можете потренироваться с одним из них.
dlga_trainer_practice_11:novicemaster_are_you_ready1|Готовы, надрать зад одному из моих людей?
dlga_novicemaster_are_you_ready1:novicemaster_ready_to_fight1|Да, я готов{reg59?а:}.
dlga_novicemaster_ready_to_fight1:close_window|Тогда вперед. Удачи!
dlga_novicemaster_are_you_ready1:novicemaster_not_ready1|Подождите минутку. Мне надо подготовиться.
dlga_novicemaster_not_ready1:close_window|Эй, без тренировок преуспеть в фехтовании невозможно.
dlga_start:close_window.90|Пожалуйста, добр{reg59?ая госпожа:ый господин}, помогите нам! Я не хочу в рабство!
dlga_start:bodo_prisoner_sl|Привет, {playername}. Рад видеть вас в добром здравии. Я думал, вас убили, когда Свен 'Бычья Шея' напал на нас. Как видите, я не был столь удачлив, как вы.
dlga_bodo_prisoner_sl:bodo_prisoner_s2|Бодо! Ну? Где моя мать? И кто эти женщины?
dlga_bodo_prisoner_sl:close_window|Давайте покинем это место, а потом поговорим.
dlga_bodo_prisoner_s2:close_window|Мы не можем говорить здесь, даже у стен есть уши. Давайте покинем это место, а потом поговорим.
dlga_start:close_window.91|Пожалуйста, добр{reg59?ая госпожа:ый господин}, помогите нам! Я не хочу в рабство!
dlga_start:bodo_merchant_1|Добрый день, {playername}. Рад видеть, что с вами все в порядке. Вы напугали нас, говоря во сне. Не хотел бы я видеть такие сновидения, как вы.
dlga_bodo_merchant_1:bodo_merchant_2|Не волнуйтесь, все хорошо.
dlga_bodo_merchant_1:bodo_merchant_22|{s10}
dlga_bodo_merchant_1:bodo_merchant_21|Не представляю, как мое состояние может отразиться на остальных.
dlga_bodo_merchant_2:bodo_merchant_3|Надеюсь. Главное, что вы живы, {reg59?дорогая:друг мой}.
dlga_bodo_merchant_22:bodo_merchant_3|{s2}
dlga_bodo_merchant_21:bodo_merchant_3|Не стоит сердиться! Я просто переживаю за вас, {reg59?дорогая:друг мой}.
dlga_bodo_merchant_3:bodo_merchant_4a|После всех этих событий, словно туман накрыл некоторые воспоминания. Напомните мне, кто вы?
dlga_bodo_merchant_3:close_window|Спасибо! Мне нужно помочь проверить те корабли. Поговорим позже.
dlga_bodo_merchant_4a:bodo_merchant_5|Да, это же я, Бодо, родом из Кантабрии, Королевство Астурия, а римляне называли Испания. Судьба столкнула нас на корабле 'Вотан Рик'.
dlga_bodo_merchant_5:bodo_merchant_6|Я хочу еще раз услышать вашу историю.
dlga_bodo_merchant_5:close_window|Ох, точно... Бодо. Ну, я пойду, мне нужно еще помочь проверить те корабли. Поговорим позже.
dlga_bodo_merchant_6:bodo_merchant_7|Давайте позже, я слежу за горизонтом, и лучше не отвлекаться. Я не капитан, но считаю, что останавливаться здесь плохая идея.
dlga_start:close_window.92|Мне показалось, что там что-то есть. Туман в этих водах, обманывает взор... Все-таки показалось. Надеюсь, мы не встретим никого. Хоть корабль и быстрый, но уйти от боевого корабля мы вряд ли сможем.
dlga_bodo_merchant_7:bodo_merchant_8|Меня тоже терзает волнение. Смотрите внимательно, мой друг.
dlga_bodo_merchant_7:close_window|И что произошло здесь? Чтобы побыстрее убраться отсюда, я помогу проверить те корабли.
dlga_bodo_merchant_8:close_window|Рад послужить здесь, хоть чем-то помочь. Самое главное, что в этом путешествии я приобрел {reg59?подружку:хорошего друга}. Жаль, но наши пути вскоре разминутся. Если в будущем нам доведется встретиться вновь, и вам нужна будет помощь, обращайтесь, {reg59?дорогая:мой друг}.
dlga_start:esposabarco_1|{s2}^^{reg59?Дочка:Сын мой}, сегодня такой хороший день! Море радует своими красками! И очень жаль, что мы наткнулись на место кораблекрушения!
dlga_esposabarco_1:esposabarco_12|Да, мама. Меня радует, что тебе сегодня лучше.
dlga_esposabarco_1:esposabarco_11|Ты помнишь меня? Значит сегодня тебе лучше. Это замечательно!
dlga_esposabarco_1:close_window|Поговорим позже, мама.
dlga_esposabarco_12:esposabarco_13|{s2}^^Мне не только лучше, еще я счастлива! Я так рада быть с тобой. Но нам нужно вернуться домой к ужину! Твой отец ждет нас.
dlga_esposabarco_11:esposabarco_13|Почему я или твой отец должны не помнить тебя? Ты моё дитя, я твоя мама.
dlga_esposabarco_13:esposabarco_14|Но... Отец умер.
dlga_esposabarco_13:close_window|Мама, мы плывем домой. Я очень люблю тебя.
dlga_esposabarco_14:esposabarco_15|{s2}^^Но... Но... Мы ведь не близко к дому, не так ли? Ох, как болит моя голова, я не помню, где наш дом! Я знаю, кто ты, но я не помню твое имя. Наверно, я окончательно сошла с ума? 
dlga_esposabarco_15:esposabarco_16|Нет, мама. Ты просто кое-что забыла.
dlga_esposabarco_15:esposabarco_17|Нет, мама, это болезнь. Но скоро мы отыщем того, кто поможет тебе.
dlga_esposabarco_15:close_window|Да, но тебе помогут избавиться от этого недуга. Поговорим позже. 
dlga_esposabarco_16:close_window|{s2}^^Ох, да помогут нам Боги. Пожалуйста, оставь меня, мне нужно отдохнуть.
dlga_esposabarco_17:esposabarco_18|{s2}^^Я не уверена, что кто-то может излечить меня, {reg59?дочка:сынок}.
dlga_esposabarco_18:close_window|Мы почти на месте! Пожалуйста, не сдавайся, крепись, мама. Мне нужно отлучиться.
dlga_start:close_window.93|Я бы поговорил с вами, но у меня еще много дел.*
dlga_start:sailors_merchant_1|Привет, {playername}. Я бы поболтал с вами, но мне нужно закончить кое-какую работу. Может позже.
dlga_sailors_merchant_1:close_window|Хорошо, поговорим вечером, когда встанем на якорь.
dlga_start:close_window.94|[Враги наблюдают за вами у стен Рединга]
dlga_start:arquerosb_merchant_1|Поговори с командиром, {playername}, тем ветераном, что стоит на носу лодки. Он тот, кто может лучше всех подготовить вас для участия в боях.
dlga_arquerosb_merchant_1:close_window|Спасибо, так и сделаю.
dlga_start:frisianship_merchant_1|Приветствую, {playername}. Вы хорошо себя чувствуете? Во сне вы резко вздрагивали и бормотали страшные вещи. Мои люди подумали, что это проделки злых духов.
dlga_frisianship_merchant_1:frisianship_merchant_2|Где я? Что это за место?
dlga_frisianship_merchant_2:frisianship_merchant_3|У-у-у, все так плохо. Вы разве не помните? Меня зовут Аво, Леоф. Я -- капитан корабля 'Вотан Рик', на котором вы, собственно, и находитесь. Вы поднялись к нам на борт неделю назад во Фризии, заплатив хорошую сумму, чтобы отплыть с нами.
dlga_frisianship_merchant_3:frisianship_merchant_4a|Да, да, вспомнил{reg59?а:}.
dlga_frisianship_merchant_3:frisianship_merchant_4b|Ох, я уже прихожу в себя. Но, возможно, вы сможете напомнить мне, почему я здесь? 
dlga_frisianship_merchant_4a:frisianship_merchant_5|Ну, не волнуйтесь. С кем не бывает.
dlga_frisianship_merchant_4b:frisianship_merchant_5|Теперь я действительно начинаю волноваться за вас. Я не знаю подробностей, лишь то, что ваша мать больна, и вы везете её к лекарю, который обладает даром исцелять людей, а держим мы путь в один фризкий порт, в поселении которого и живет этот человек. Видать переживания так сказались на вас.
dlga_frisianship_merchant_5:frisianship_merchant_6|Спасибо! Но разве мы не должны поспешить, и идти в полный парус? Корабль стоит! Что происходит? Почему мы остановились?
dlga_start:close_window.95|Может мы поговорим с вами позже, {reg59?госпожа:господин}? Мне нужно отдать пару распоряжений своим людям.
dlga_start:frisianship_merchant_talk|Хороший день. Можно продолжить наш путь. Вы готовы?
dlga_frisianship_merchant_talk:frisianship_merchant_1x|Да, вперед.
dlga_frisianship_merchant_talk:close_window|Нет, у меня есть еще кое-какие дела.
dlga_frisianship_merchant_1x:frisianship_merchant_2x|{s2}^^Мы уже достаточно долго вместе путешествуем, может, вы хотите немного поуправлять кораблем. Он держится очень уверено для торгового судна.
dlga_frisianship_merchant_2x:close_window|Да, а то я уже думал{reg59?а:}, что вы никогда не предложите.
dlga_frisianship_merchant_2x:close_window.1|Нет. Поверьте мне, я встану, за рулевое весло только в крайнем случае! 
dlga_frisianship_merchant_6:frisianship_merchant_7|Мы обнаружили обломки,  полу-затопленных кораблей. Похоже, совсем недавно тут был бой. Мои люди занимаются поиском выживших людей. Бедные, у них не было шансов уйти от кораблей Викингов. Не переживайте, мы скоро продолжим наш путь.
dlga_frisianship_merchant_7:frisianship_merchant_8|Мы можем поторопиться? Те, кто потопил эти корабли, могут быть где-то рядом.
dlga_frisianship_merchant_7:close_window|Что ж, надо меньше волноваться. Думаю, нужно пойти и помочь им.
dlga_frisianship_merchant_8:frisianship_merchant_9|{s2}^^Расслабься, {reg59?подруга:приятель}. Ваш друг, Бодо, настоял на том, что постоит в дозоре. Я сомневаюсь, что такой товарищ что-то упустит из виду!
dlga_frisianship_merchant_9:frisianship_merchant_10|Бодо? Да, от того, что он в дозоре не стало спокойнее на душе.
dlga_frisianship_merchant_9:frisianship_merchant_11|Я надеюсь, вы знаете, что делаете.
dlga_frisianship_merchant_10:close_window|{s2}^^Если бы вы были на одном из этих кораблей, и плавали на обломке корабля, думаю, вы бы хотели, чтобы вас нашли, не так ли? Таковы законы моря -- особенно в этих краях. 
dlga_frisianship_merchant_11:close_window|Будь уверен{reg59?а дорогая,: приятель,} я знаю, что делаю. Теперь позвольте мне помочь остальным, иначе мы задержимся, здесь надолго.
dlga_start:frisianship_mer_1|Ох, Один, мы в беде!
dlga_start:close_window.96|Мы можем поговорить позже, {reg59?госпожа:господин}? Мне просто нужно дать пару распоряжений своим людям.
dlga_frisianship_mer_1:frisianship_mer_2|Что случилось?
dlga_frisianship_mer_2:frisianship_mer_3|Цыц! Сохраняйте спокойствие. Мы в опасности. Пока мы наблюдали за вашим боем, были замечены два длинных корабля. Сейчас я смогу разглядеть знамя... Это Свен 'Бычья Шея'! Черт их подери! Молитесь своим Богам! Черт, молитесь любым Богам! Главное уйти от них, если нас поймают, то уже никто нам не поможет. 
dlga_frisianship_mer_3:frisianship_mer_4c|Я чувствовал{reg59?а:} это! Мы не должны были здесь вставать на якорь. 
dlga_frisianship_mer_3:frisianship_mer_4b|Успокойся! И скажи мне: кто такой Свен?
dlga_frisianship_mer_3:frisianship_mer_4c.1|Ужас! Что мы будем делать?
dlga_frisianship_mer_4b:frisianship_mer_4c|Вы не услышали о нем? Свен -- Викинг. Худший Викинг из Викингов. Он жжет деревни, топит корабли, порабощает людей или просто вырезает всех до единого человека, кто встретился на его пути. Все уничтожает! Но самое страшное, каждый раз, после нападения, он выбирает одного человека и приносит его в жертву своим богам, ужасным ритуалом, его называют 'кровавый орел'. Вы слышали о таком? Вы же не хотите узнать, что это означает. Тогда слушайте меня, и не перечьте
dlga_frisianship_mer_4c:frisianship_mer_5|{s2}^^Я думаю, что они пройдут мимо. Если мы останемся прямо здесь, они могут подумать, что мы один из тех полузатонувших кораблей. Это наша единственная надежда...
dlga_frisianship_mer_5:frisianship_mer_6|Что? Мы уже должны были скрыться в тумане. У вас столько людей, на весла и вперед.
dlga_frisianship_mer_5:frisianship_mer_6.1|Пожалуйста, успокойтесь, {reg59?леди:друг мой}. Мы не должны этого делать!
dlga_frisianship_mer_6:close_window|{s1}^^Свен заметил нас! Они поворачивают на нас! Хватит ждать. Режьте якорь и начинайте грести! О, Один, все бесполезно. Помогите!
dlga_start:petro_leader_1|Приветствую вас! Меня зовут Петро Дидаз из Овето. Я -- герцог на службе у Короля Альдефонсо из Астурии. Хочу представить вам Сило, он и его люди прибыли из Фарума, что в Галлеции, а так же Гундинсальво, прибывший со своими воинами из Амайя, что в Кантабрии. Мы поражены тем, что вы предстали перед нами с большим войском и флотом. Мы хотим знать, кто вы?
dlga_petro_leader_1:petro_leader_3|Меня зовут {playername}. Я здесь, чтобы вести с вами переговоры от имени сыновей Рагнара.
dlga_petro_leader_1:petro_leaderwessex_4|Меня зовут {playername}. Король Уэссекса, Этельред, прислал меня, чтобы сопроводить вас в его земли.
dlga_petro_leader_3:petro_leader_31|Я так не думаю...
dlga_petro_leader_31:petro_leader_32|Сыны Рагнара сильны, как никогда. Их влияние распространилось на многие земли. Вы должны выслушать меня, и узнать об их предложении.
dlga_petro_leader_32:petro_leader_33|{s2}^^Что ж, выслушаем их посланника. Ведь мы можем убить {reg59?ее:его} после того, как {reg59?она:он} пропоет нам свою песню.
dlga_petro_leader_33:petro_leader_34|Ратбарт Рагнарссон хочет, чтобы вы присоединились к нему и его братьям против Уэссекса.
dlga_petro_leader_33:petro_leader_34.1|Ратбарт Рагнарссон обещает вам половину земель Уэссекса, если вы присоединитесь к нему.
dlga_petro_leader_33:petro_leader_34.2|Ратбарт Рагнарссон наполнит ваши корабли золотом, если вы присоединитесь к нему.
dlga_petro_leader_34:petro_leader_35|А если они откажутся, что он сделает? Убьет их? Он послал вас сюда с флотом, чтобы подружиться?
dlga_petro_leader_35:petro_leader_36|Бодо?
dlga_petro_leader_35:petro_leader_36_1|Точно. Выбор за вами.
dlga_petro_leader_35:petro_leader_36_2|Если бы я хотел{reg59?а:} уничтожить вас, то давно бы напал{reg59?а:}. Я предлагаю союз, поддерживающий победителей.
dlga_petro_leader_36_1:petro_leader_36|{s2}^^Обожаю, когда говорят просто и понятно. Мне нравится {reg59?эта девица:этот парень}.
dlga_petro_leader_36_2:petro_leader_36|Теперь вы говорите.
dlga_petro_leader_36:petro_leader_37|{reg59?Эта женщина -- лгунья:Этот человек -- лжец}. Я долго путешествовал с {reg59?ней:ним}. Стал настоящим другом для {reg59?нее:него}. Мы сражались бок о бок, вместе проливали кровь. Верой и правдой служил я {reg59?ей:ему}. Но когда пришло время, {reg59?она:он} предал меня и доставил письмо Викингам. Вот почему {reg59?она:он} сегодня здесь, с этим флотом: чтобы уничтожить вас и союз между Уэссексом, Франкией и Астурией.
dlga_petro_leader_37:petro_leader_37_1|Датчане правят в северных землях. Создание союза в интересах Астурии, он защитит их земли с севера.  
dlga_petro_leader_37:petro_leader_38_1|Уэссекс слаб, а их земли легко завоевать. Разве вы не хотите озолотиться, разграбив богатое королевство, и купаться в лучах славы? 
dlga_petro_leader_37:petro_leader_41|Я преодолел{reg59?а:} такой долгий путь не ради того, чтобы выслушивать эту ерунду.
dlga_petro_leader_37_1:petro_leader_37_2|Как и нами, благо хоть не долго. Лучше союз с Данией, чем с Западными Саксами. Дания правит практически всем севером, а Уэссекс еле управляются в своих землях. Перейдем на сторону Дании, и защитим себя от набегов Викингов. Возможно, мы сможем даже использовать их силу против Аль-Андалуса.
